[
  {
    "itemID": "vocab-a2-context-01", "schemaVersion": 1, "cefrLevel": "A2", "skill": "vocabulary", "subskill": "context meaning", "mode": "objective",
    "prompt": "The delivery is late, so we need to ___ the customer.", "options": ["inform", "borrow", "repair"], "correctAnswer": "inform",
    "explanation": "Inform means to give someone information.", "difficulty": 2, "estimatedSeconds": 35, "tags": ["work", "verb-choice"],
    "source": "SpeakStep original item", "version": 1, "status": "active", "evaluationScope": "Vocabulary choice in a short workplace sentence."
  },
  {
    "itemID": "vocab-b1-collocation-01", "schemaVersion": 1, "cefrLevel": "B1", "skill": "vocabulary", "subskill": "collocation", "mode": "objective",
    "prompt": "Which phrase best completes the sentence? We need to ___ a decision by Friday.", "options": ["make", "do", "create up"], "correctAnswer": "make",
    "explanation": "English uses the collocation make a decision.", "difficulty": 3, "estimatedSeconds": 35, "tags": ["collocation", "work"],
    "source": "SpeakStep original item", "version": 1, "status": "active", "evaluationScope": "Common B1 collocation recognition."
  },
  {
    "itemID": "vocab-b2-nuance-01", "schemaVersion": 1, "cefrLevel": "B2", "skill": "vocabulary", "subskill": "meaning nuance", "mode": "objective",
    "prompt": "A workable proposal is one that is ___.", "options": ["practical enough to succeed", "impossible to change", "written in formal language"], "correctAnswer": "practical enough to succeed",
    "explanation": "Workable describes a practical solution that can succeed.", "difficulty": 4, "estimatedSeconds": 40, "tags": ["nuance", "negotiation"],
    "source": "SpeakStep original item", "version": 1, "status": "active", "evaluationScope": "B2 meaning distinction in context."
  },
  {
    "itemID": "vocab-b2-register-02", "schemaVersion": 1, "cefrLevel": "B2", "skill": "vocabulary", "subskill": "register", "mode": "objective",
    "prompt": "Which is the most diplomatic way to describe a problem in a client email?", "options": ["Your request is impossible.", "We are facing a timing constraint.", "You caused a bad schedule."], "correctAnswer": "We are facing a timing constraint.",
    "explanation": "Timing constraint states the limitation without blaming the client.", "difficulty": 4.2, "estimatedSeconds": 45, "tags": ["register", "business-email"],
    "source": "SpeakStep original item", "version": 1, "status": "active", "evaluationScope": "Diplomatic lexical choice in business communication."
  },
  {
    "itemID": "vocab-c1-precision-01", "schemaVersion": 1, "cefrLevel": "C1", "skill": "vocabulary", "subskill": "precision", "mode": "objective",
    "prompt": "Which word best describes evidence that appears convincing but is not conclusive?", "options": ["suggestive", "identical", "mandatory"], "correctAnswer": "suggestive",
    "explanation": "Suggestive evidence points toward a conclusion without proving it.", "difficulty": 5, "estimatedSeconds": 45, "tags": ["precision", "evidence"],
    "source": "SpeakStep original item", "version": 1, "status": "active", "evaluationScope": "C1 precision of abstract vocabulary."
  },

  {
    "itemID": "grammar-a2-past-01", "schemaVersion": 1, "cefrLevel": "A2", "skill": "grammar", "subskill": "past simple", "mode": "objective",
    "prompt": "Yesterday, the supplier ___ the revised schedule.", "options": ["sent", "sends", "sending"], "correctAnswer": "sent",
    "explanation": "Yesterday signals the past simple form sent.", "difficulty": 2, "estimatedSeconds": 30, "tags": ["past-simple", "time-reference"],
    "source": "SpeakStep original item", "version": 1, "status": "active", "evaluationScope": "Past tense selection with an explicit time marker."
  },
  {
    "itemID": "grammar-b1-conditional-01", "schemaVersion": 1, "cefrLevel": "B1", "skill": "grammar", "subskill": "first conditional", "mode": "objective",
    "prompt": "If the parts arrive today, we ___ production tomorrow.", "options": ["will start", "started", "would have started"], "correctAnswer": "will start",
    "explanation": "A real future condition uses if + present and will + verb.", "difficulty": 3, "estimatedSeconds": 35, "tags": ["conditional", "planning"],
    "source": "SpeakStep original item", "version": 1, "status": "active", "evaluationScope": "First conditional form and meaning."
  },
  {
    "itemID": "grammar-b2-concession-01", "schemaVersion": 1, "cefrLevel": "B2", "skill": "grammar", "subskill": "concession", "mode": "objective",
    "prompt": "___ the deadline is demanding, the team believes it is achievable.", "options": ["Although", "Because of", "Unless"], "correctAnswer": "Although",
    "explanation": "Although introduces a contrast between difficulty and achievability.", "difficulty": 4, "estimatedSeconds": 40, "tags": ["concession", "linking"],
    "source": "SpeakStep original item", "version": 1, "status": "active", "evaluationScope": "B2 clause linking and concession."
  },
  {
    "itemID": "grammar-b2-modal-02", "schemaVersion": 1, "cefrLevel": "B2", "skill": "grammar", "subskill": "past deduction", "mode": "objective",
    "prompt": "The client did not receive the email. It ___ to the wrong address.", "options": ["may have been sent", "must send", "may be sending yesterday"], "correctAnswer": "may have been sent",
    "explanation": "May have been sent expresses an uncertain deduction about a past passive event.", "difficulty": 4.3, "estimatedSeconds": 45, "tags": ["modal", "past-deduction", "passive"],
    "source": "SpeakStep original item", "version": 1, "status": "active", "evaluationScope": "Modal perfect passive for cautious past deduction."
  },
  {
    "itemID": "grammar-c1-inversion-01", "schemaVersion": 1, "cefrLevel": "C1", "skill": "grammar", "subskill": "inversion", "mode": "objective",
    "prompt": "Choose the correct formal sentence.", "options": ["Rarely we have seen such a rapid change.", "Rarely have we seen such a rapid change.", "Rarely did we have saw such a rapid change."], "correctAnswer": "Rarely have we seen such a rapid change.",
    "explanation": "A negative adverb at the beginning triggers auxiliary-subject inversion.", "difficulty": 5, "estimatedSeconds": 50, "tags": ["inversion", "formal-register"],
    "source": "SpeakStep original item", "version": 1, "status": "active", "evaluationScope": "C1 inversion after a fronted negative adverb."
  },

  {
    "itemID": "reading-a2-detail-01", "schemaVersion": 1, "cefrLevel": "A2", "skill": "reading", "subskill": "explicit detail", "mode": "objective",
    "prompt": "Notice: The meeting starts at 10:30 in Room 4. Please arrive ten minutes early. When should participants arrive?", "options": ["10:20", "10:30", "10:40"], "correctAnswer": "10:20",
    "explanation": "Ten minutes before 10:30 is 10:20.", "difficulty": 2, "estimatedSeconds": 45, "tags": ["detail", "time"],
    "source": "SpeakStep original item", "version": 1, "status": "active", "evaluationScope": "Locate one explicit detail in a short notice."
  },
  {
    "itemID": "reading-b1-purpose-01", "schemaVersion": 1, "cefrLevel": "B1", "skill": "reading", "subskill": "writer purpose", "mode": "objective",
    "prompt": "Message: We cannot confirm Friday delivery yet, but we will send a firm update by 3 p.m. tomorrow. What is the main purpose?", "options": ["To cancel the order", "To manage uncertainty and promise an update", "To confirm Friday delivery"], "correctAnswer": "To manage uncertainty and promise an update",
    "explanation": "The writer avoids an unsupported promise and gives a precise next update.", "difficulty": 3, "estimatedSeconds": 55, "tags": ["purpose", "customer-update"],
    "source": "SpeakStep original item", "version": 1, "status": "active", "evaluationScope": "Identify communicative purpose in a short workplace message."
  },
  {
    "itemID": "reading-b2-inference-01", "schemaVersion": 1, "cefrLevel": "B2", "skill": "reading", "subskill": "inference", "mode": "objective",
    "prompt": "A report highlights a 50% increase but notes only in a footnote that cases rose from two to three. What concern does this raise?", "options": ["The percentage is mathematically false", "The presentation may exaggerate the practical significance", "Footnotes are never reliable"], "correctAnswer": "The presentation may exaggerate the practical significance",
    "explanation": "The percentage is true, but the small baseline changes how important it appears.", "difficulty": 4, "estimatedSeconds": 65, "tags": ["inference", "evidence", "baseline"],
    "source": "SpeakStep original item", "version": 1, "status": "active", "evaluationScope": "Infer a limitation from how evidence is presented."
  },
  {
    "itemID": "reading-b2-stance-02", "schemaVersion": 1, "cefrLevel": "B2", "skill": "reading", "subskill": "stance", "mode": "objective",
    "prompt": "Text: Hybrid work is not simply a choice between freedom and control. Its success depends on matching each activity to the environment that supports it. Which view best matches the writer?", "options": ["All work should be remote", "Location rules should depend on the type of work", "Office work always improves performance"], "correctAnswer": "Location rules should depend on the type of work",
    "explanation": "The writer recommends choosing location according to the activity.", "difficulty": 4.2, "estimatedSeconds": 65, "tags": ["stance", "summary", "hybrid-work"],
    "source": "SpeakStep original item", "version": 1, "status": "active", "evaluationScope": "Identify a nuanced writer stance."
  },
  {
    "itemID": "reading-c1-argument-01", "schemaVersion": 1, "cefrLevel": "C1", "skill": "reading", "subskill": "argument structure", "mode": "objective",